Name,SKU,Barcode,Category,Unit,Cost Price,Selling Price,Quantity,Min Stock,Description
Wireless Bluetooth Headphones,WBH-001,6901234567001,Electronics,piece,45.00,89.99,25,5,Over-ear noise cancelling wireless headphones
Organic Green Tea 50 Bags,OGT-100,6901234567002,Food & Beverage,box,3.50,7.99,60,10,Premium organic green tea bags - 50 count
Yoga Mat Non-Slip 6mm,YM-PRO6,6901234567003,Sports,piece,12.00,29.99,15,3,Eco-friendly non-slip yoga mat with carrying strap
Ballpoint Pen Set 12pc,BPS-012,6901234567004,Office Supplies,set,2.00,5.49,80,20,Smooth writing ballpoint pens - blue ink - 12 pack
Vitamin C 1000mg 60 Tablets,VTC-060,6901234567005,Health & Beauty,bottle,6.00,14.99,40,8,High-potency Vitamin C supplement - 60 tablets
